<?xml version="1.0" encoding="UTF-8" ?>
        <!--
        -->
        <!ELEMENT table (column* | resultmap* | operation*)+>
        <!ATTLIST table
                sqlname CDATA #IMPLIED
                sequence CDATA #IMPLIED
                physicalName CDATA #IMPLIED
                remark CDATA #IMPLIED
                >
        <!--
        -->
        <!ELEMENT column EMPTY>
        <!ATTLIST column
                name CDATA #REQUIRED
                javatype CDATA #REQUIRED
                jdbctype CDATA #REQUIRED
                remark CDATA #REQUIRED
                relatedColumn CDATA #IMPLIED
                >

        <!--
         -->
        <!ELEMENT resultmap (column)*>
        <!ATTLIST resultmap
                name CDATA #REQUIRED
                type CDATA #REQUIRED
                remark CDATA #IMPLIED
                >
        <!--
        -->
        <!ELEMENT operation (#PCDATA | selectKey | include | trim | where | set | foreach | choose | if | bind)*>
        <!ATTLIST operation
                name CDATA #REQUIRED
                paging CDATA #IMPLIED
                paramtype (object|primitive) #IMPLIED
                multiplicity (one|many|paging) #IMPLIED
                remark CDATA #IMPLIED
                resulttype CDATA #IMPLIED
                resultmap CDATA #IMPLIED
                timeout CDATA #IMPLIED
                >

        <!ELEMENT include EMPTY>
        <!ATTLIST include
                refid CDATA #REQUIRED
                >


        <!ELEMENT selectKey (#PCDATA | include)*>
        <!ATTLIST selectKey
                resultType CDATA #IMPLIED
                keyProperty CDATA #IMPLIED
                order (BEFORE|AFTER) #IMPLIED
                >

        <!-- - - - - - - - - - - - - - - - - - - - - - - - -
                         DYNAMIC ELEMENTS
          - - - - - - - - - - - - - - - - - - - - - - - - -->


        <!ELEMENT bind EMPTY>
        <!ATTLIST bind
                name CDATA #REQUIRED
                value CDATA #REQUIRED
                >

        <!ELEMENT trim (#PCDATA | include | trim | where | set | foreach | choose | if | bind)*>
        <!ATTLIST trim
                prefix CDATA #IMPLIED
                prefixOverrides CDATA #IMPLIED
                suffix CDATA #IMPLIED
                suffixOverrides CDATA #IMPLIED
                >
        <!ELEMENT where (#PCDATA | include | trim | where | set | foreach | choose | if | bind)*>
        <!ELEMENT set (#PCDATA | include | trim | where | set | foreach | choose | if | bind)*>

        <!ELEMENT foreach (#PCDATA | include | trim | where | set | foreach | choose | if | bind)*>
        <!ATTLIST foreach
                collection CDATA #REQUIRED
                item CDATA #IMPLIED
                index CDATA #IMPLIED
                open CDATA #IMPLIED
                close CDATA #IMPLIED
                separator CDATA #IMPLIED
                >

        <!ELEMENT choose (when* , otherwise?)>
        <!ELEMENT when (#PCDATA | include | trim | where | set | foreach | choose | if | bind)*>
        <!ATTLIST when
                test CDATA #REQUIRED
                >
        <!ELEMENT otherwise (#PCDATA | include | trim | where | set | foreach | choose | if | bind)*>

        <!ELEMENT if (#PCDATA | include | trim | where | set | foreach | choose | if | bind)*>
        <!ATTLIST if
                test CDATA #REQUIRED
                >
